14:38:57.421991 IP (tos 0x0, ttl 64, id 46983, offset 0, flags [DF], proto TCP (6), length 60)
    192.168.0.104.55636 > 178.234.29.197.22: Flags [S], cksum 0x422b (correct), seq 2065177742, win 64240, options [mss 1460,sackOK,TS val 925946082 ecr 0,nop,wscale 7], length 0
14:38:57.461086 IP (tos 0x0, ttl 49, id 0, offset 0, flags [DF], proto TCP (6), length 60)
    178.234.29.197.22 > 192.168.0.104.55636: Flags [S.], cksum 0x8244 (correct), seq 790409789, ack 2065177743, win 28960, options [mss 1440,sackOK,TS val 1814821940 ecr 925946082,nop,wscale 7], length 0
14:38:57.461293 IP (tos 0x0, ttl 64, id 46984, offset 0, flags [DF], proto TCP (6), length 52)
    192.168.0.104.55636 > 178.234.29.197.22: Flags [.], cksum 0x2000 (correct), ack 1, win 502, options [nop,nop,TS val 925946121 ecr 1814821940], length 0
14:38:57.462904 IP (tos 0x0, ttl 64, id 46985, offset 0, flags [DF], proto TCP (6), length 93)
    192.168.0.104.55636 > 178.234.29.197.22: Flags [P.], cksum 0xfea4 (correct), seq 1:42, ack 1, win 502, options [nop,nop,TS val 925946123 ecr 1814821940], length 41
14:38:57.502721 IP (tos 0x0, ttl 49, id 57732, offset 0, flags [DF], proto TCP (6), length 52)
    178.234.29.197.22 > 192.168.0.104.55636: Flags [.], cksum 0x20de (correct), ack 42, win 227, options [nop,nop,TS val 1814821950 ecr 925946123], length 0
14:38:57.515464 IP (tos 0x0, ttl 49, id 57733, offset 0, flags [DF], proto TCP (6), length 94)
    178.234.29.197.22 > 192.168.0.104.55636: Flags [P.], cksum 0xfa55 (correct), seq 1:43, ack 42, win 227, options [nop,nop,TS val 1814821951 ecr 925946123], length 42
14:38:57.515656 IP (tos 0x0, ttl 64, id 46986, offset 0, flags [DF], proto TCP (6), length 52)
    192.168.0.104.55636 > 178.234.29.197.22: Flags [.], cksum 0x1f6b (correct), ack 43, win 502, options [nop,nop,TS val 925946176 ecr 1814821951], length 0
14:38:57.518387 IP (tos 0x0, ttl 64, id 46987, offset 0, flags [DF], proto TCP (6), length 1480)
    192.168.0.104.55636 > 178.234.29.197.22: Flags [.], cksum 0x4979 (correct), seq 42:1470, ack 43, win 502, options [nop,nop,TS val 925946179 ecr 1814821951], length 1428
14:38:57.518423 IP (tos 0x0, ttl 64, id 46988, offset 0, flags [DF], proto TCP (6), length 136)
    192.168.0.104.55636 > 178.234.29.197.22: Flags [P.], cksum 0xebfd (correct), seq 1470:1554, ack 43, win 502, options [nop,nop,TS val 925946179 ecr 1814821951], length 84
14:38:57.557992 IP (tos 0x0, ttl 49, id 57734, offset 0, flags [DF], proto TCP (6), length 1028)
    178.234.29.197.22 > 192.168.0.104.55636: Flags [P.], cksum 0x10da (correct), seq 43:1019, ack 42, win 227, options [nop,nop,TS val 1814821963 ecr 925946176], length 976
14:38:57.558105 IP (tos 0x0, ttl 64, id 46989, offset 0, flags [DF], proto TCP (6), length 52)
    192.168.0.104.55636 > 178.234.29.197.22: Flags [.], cksum 0x1584 (correct), ack 1019, win 495, options [nop,nop,TS val 925946218 ecr 1814821963], length 0
14:38:57.558243 IP (tos 0x0, ttl 49, id 57735, offset 0, flags [DF], proto TCP (6), length 52)
    178.234.29.197.22 > 192.168.0.104.55636: Flags [.], cksum 0x169f (correct), ack 1554, win 250, options [nop,nop,TS val 1814821964 ecr 925946179], length 0
14:38:57.573850 IP (tos 0x0, ttl 64, id 46990, offset 0, flags [DF], proto TCP (6), length 100)
    192.168.0.104.55636 > 178.234.29.197.22: Flags [P.], cksum 0x5699 (correct), seq 1554:1602, ack 1019, win 501, options [nop,nop,TS val 925946234 ecr 1814821964], length 48
14:38:57.623389 IP (tos 0x0, ttl 49, id 57736, offset 0, flags [DF], proto TCP (6), length 416)
    178.234.29.197.22 > 192.168.0.104.55636: Flags [P.], cksum 0x3ef0 (correct), seq 1019:1383, ack 1602, win 250, options [nop,nop,TS val 1814821980 ecr 925946234], length 364
14:38:57.623520 IP (tos 0x0, ttl 64, id 46991, offset 0, flags [DF], proto TCP (6), length 52)
    192.168.0.104.55636 > 178.234.29.197.22: Flags [.], cksum 0x1391 (correct), ack 1383, win 499, options [nop,nop,TS val 925946284 ecr 1814821980], length 0
14:38:57.639380 IP (tos 0x0, ttl 64, id 46992, offset 0, flags [DF], proto TCP (6), length 68)
    192.168.0.104.55636 > 178.234.29.197.22: Flags [P.], cksum 0x0946 (correct), seq 1602:1618, ack 1383, win 501, options [nop,nop,TS val 925946300 ecr 1814821980], length 16
14:38:57.720052 IP (tos 0x0, ttl 49, id 57737, offset 0, flags [DF], proto TCP (6), length 52)
    178.234.29.197.22 > 192.168.0.104.55636: Flags [.], cksum 0x1452 (correct), ack 1618, win 250, options [nop,nop,TS val 1814822004 ecr 925946300], length 0
14:38:57.720211 IP (tos 0x0, ttl 64, id 46993, offset 0, flags [DF], proto TCP (6), length 96)
    192.168.0.104.55636 > 178.234.29.197.22: Flags [P.], cksum 0x0efe (correct), seq 1618:1662, ack 1383, win 501, options [nop,nop,TS val 925946380 ecr 1814822004], length 44
14:38:57.763043 IP (tos 0x0, ttl 49, id 57738, offset 0, flags [DF], proto TCP (6), length 52)
    178.234.29.197.22 > 192.168.0.104.55636: Flags [.], cksum 0x13cc (correct), ack 1662, win 250, options [nop,nop,TS val 1814822014 ecr 925946380], length 0
14:38:57.763167 IP (tos 0x0, ttl 49, id 57739, offset 0, flags [DF], proto TCP (6), length 96)
    178.234.29.197.22 > 192.168.0.104.55636: Flags [P.], cksum 0x7ee3 (correct), seq 1383:1427, ack 1662, win 250, options [nop,nop,TS val 1814822014 ecr 925946380], length 44
14:38:57.763849 IP (tos 0x0, ttl 64, id 46994, offset 0, flags [DF], proto TCP (6), length 120)
    192.168.0.104.55636 > 178.234.29.197.22: Flags [P.], cksum 0x8a3e (correct), seq 1662:1730, ack 1427, win 501, options [nop,nop,TS val 925946424 ecr 1814822014], length 68
14:38:57.803872 IP (tos 0x0, ttl 49, id 57740, offset 0, flags [DF], proto TCP (6), length 104)
    178.234.29.197.22 > 192.168.0.104.55636: Flags [P.], cksum 0x8c3d (correct), seq 1427:1479, ack 1730, win 250, options [nop,nop,TS val 1814822025 ecr 925946424], length 52
14:38:57.804715 IP (tos 0x0, ttl 64, id 46995, offset 0, flags [DF], proto TCP (6), length 552)
    192.168.0.104.55636 > 178.234.29.197.22: Flags [P.], cksum 0x663f (correct), seq 1730:2230, ack 1479, win 501, options [nop,nop,TS val 925946465 ecr 1814822025], length 500
14:38:57.844829 IP (tos 0x0, ttl 49, id 57741, offset 0, flags [DF], proto TCP (6), length 512)
    178.234.29.197.22 > 192.168.0.104.55636: Flags [P.], cksum 0x0348 (correct), seq 1479:1939, ack 2230, win 273, options [nop,nop,TS val 1814822035 ecr 925946465], length 460
14:38:57.878757 IP (tos 0x0, ttl 64, id 46996, offset 0, flags [DF], proto TCP (6), length 960)
    192.168.0.104.55636 > 178.234.29.197.22: Flags [P.], cksum 0x9bc2 (correct), seq 2230:3138, ack 1939, win 501, options [nop,nop,TS val 925946539 ecr 1814822035], length 908
14:38:57.921412 IP (tos 0x0, ttl 49, id 57742, offset 0, flags [DF], proto TCP (6), length 80)
    178.234.29.197.22 > 192.168.0.104.55636: Flags [P.], cksum 0x7726 (correct), seq 1939:1967, ack 3138, win 295, options [nop,nop,TS val 1814822054 ecr 925946539], length 28
14:38:57.921557 IP (tos 0x0, ttl 49, id 57743, offset 0, flags [DF], proto TCP (6), length 64)
    178.234.29.197.22 > 192.168.0.104.55636: Flags [.], cksum 0x906f (correct), ack 3138, win 295, options [nop,nop,TS val 1814822054 ecr 925946539,nop,nop,sack 1 {2230:3138}], length 0
14:38:57.922443 IP (tos 0x0, ttl 64, id 46997, offset 0, flags [DF], proto TCP (6), length 164)
    192.168.0.104.55636 > 178.234.29.197.22: Flags [P.], cksum 0xa9fd (correct), seq 3138:3250, ack 1967, win 501, options [nop,nop,TS val 925946583 ecr 1814822054], length 112
14:38:57.961794 IP (tos 0x0, ttl 49, id 57744, offset 0, flags [DF], proto TCP (6), length 52)
    178.234.29.197.22 > 192.168.0.104.55636: Flags [.], cksum 0x0a25 (correct), ack 3250, win 295, options [nop,nop,TS val 1814822065 ecr 925946583], length 0
14:38:58.169223 IP (tos 0x0, ttl 49, id 57745, offset 0, flags [DF], proto TCP (6), length 992)
    178.234.29.197.22 > 192.168.0.104.55636: Flags [P.], cksum 0x5ebf (correct), seq 1967:2907, ack 3250, win 295, options [nop,nop,TS val 1814822117 ecr 925946583], length 940
14:38:58.212501 IP (tos 0x0, ttl 64, id 46998, offset 0, flags [DF], proto TCP (6), length 52)
    192.168.0.104.55636 > 178.234.29.197.22: Flags [.], cksum 0x0455 (correct), ack 2907, win 501, options [nop,nop,TS val 925946873 ecr 1814822117], length 0
14:38:58.251127 IP (tos 0x0, ttl 49, id 57746, offset 0, flags [DF], proto TCP (6), length 96)
    178.234.29.197.22 > 192.168.0.104.55636: Flags [P.], cksum 0x8ca2 (correct), seq 2907:2951, ack 3250, win 295, options [nop,nop,TS val 1814822137 ecr 925946873], length 44
14:38:58.251281 IP (tos 0x0, ttl 64, id 46999, offset 0, flags [DF], proto TCP (6), length 52)
    192.168.0.104.55636 > 178.234.29.197.22: Flags [.], cksum 0x03ef (correct), ack 2951, win 501, options [nop,nop,TS val 925946911 ecr 1814822137], length 0
14:38:58.251665 IP (tos 0x10, ttl 64, id 47000, offset 0, flags [DF], proto TCP (6), length 1140)
    192.168.0.104.55636 > 178.234.29.197.22: Flags [P.], cksum 0x2340 (correct), seq 3250:4338, ack 2951, win 501, options [nop,nop,TS val 925946912 ecr 1814822137], length 1088
14:38:58.290950 IP (tos 0x0, ttl 49, id 57747, offset 0, flags [DF], proto TCP (6), length 52)
    178.234.29.197.22 > 192.168.0.104.55636: Flags [.], cksum 0x005b (correct), ack 4338, win 318, options [nop,nop,TS val 1814822147 ecr 925946912], length 0
14:38:58.291738 IP (tos 0x0, ttl 49, id 57748, offset 0, flags [DF], proto TCP (6), length 160)
    178.234.29.197.22 > 192.168.0.104.55636: Flags [P.], cksum 0x56b3 (correct), seq 2951:3059, ack 4338, win 318, options [nop,nop,TS val 1814822147 ecr 925946912], length 108
14:38:58.291834 IP (tos 0x10, ttl 64, id 47001, offset 0, flags [DF], proto TCP (6), length 52)
    192.168.0.104.55636 > 178.234.29.197.22: Flags [.], cksum 0xff0f (correct), ack 3059, win 501, options [nop,nop,TS val 925946952 ecr 1814822147], length 0
14:38:58.294625 IP (tos 0x0, ttl 49, id 57749, offset 0, flags [DF], proto TCP (6), length 776)
    178.234.29.197.22 > 192.168.0.104.55636: Flags [P.], cksum 0x1242 (correct), seq 3059:3783, ack 4338, win 318, options [nop,nop,TS val 1814822147 ecr 925946912], length 724
14:38:58.294755 IP (tos 0x10, ttl 64, id 47002, offset 0, flags [DF], proto TCP (6), length 52)
    192.168.0.104.55636 > 178.234.29.197.22: Flags [.], cksum 0xfc3d (correct), ack 3783, win 496, options [nop,nop,TS val 925946955 ecr 1814822147], length 0
14:38:58.296397 IP (tos 0x0, ttl 49, id 57750, offset 0, flags [DF], proto TCP (6), length 88)
    178.234.29.197.22 > 192.168.0.104.55636: Flags [P.], cksum 0x28f3 (correct), seq 3783:3819, ack 4338, win 318, options [nop,nop,TS val 1814822148 ecr 925946912], length 36
14:38:58.296460 IP (tos 0x10, ttl 64, id 47003, offset 0, flags [DF], proto TCP (6), length 52)
    192.168.0.104.55636 > 178.234.29.197.22: Flags [.], cksum 0xfc16 (correct), ack 3819, win 496, options [nop,nop,TS val 925946957 ecr 1814822148], length 0
14:39:02.494651 IP (tos 0x10, ttl 64, id 47004, offset 0, flags [DF], proto TCP (6), length 88)
    192.168.0.104.55636 > 178.234.29.197.22: Flags [P.], cksum 0x2788 (correct), seq 4338:4374, ack 3819, win 501, options [nop,nop,TS val 925951155 ecr 1814822148], length 36
14:39:02.533241 IP (tos 0x0, ttl 49, id 57751, offset 0, flags [DF], proto TCP (6), length 88)
    178.234.29.197.22 > 192.168.0.104.55636: Flags [P.], cksum 0xadd8 (correct), seq 3819:3855, ack 4374, win 318, options [nop,nop,TS val 1814823208 ecr 925951155], length 36
14:39:02.533347 IP (tos 0x10, ttl 64, id 47005, offset 0, flags [DF], proto TCP (6), length 52)
    192.168.0.104.55636 > 178.234.29.197.22: Flags [.], cksum 0xe718 (correct), ack 3855, win 501, options [nop,nop,TS val 925951194 ecr 1814823208], length 0
14:39:02.689271 IP (tos 0x10, ttl 64, id 47006, offset 0, flags [DF], proto TCP (6), length 88)
    192.168.0.104.55636 > 178.234.29.197.22: Flags [P.], cksum 0x8132 (correct), seq 4374:4410, ack 3855, win 501, options [nop,nop,TS val 925951349 ecr 1814823208], length 36
14:39:02.743023 IP (tos 0x0, ttl 49, id 57752, offset 0, flags [DF], proto TCP (6), length 88)
    178.234.29.197.22 > 192.168.0.104.55636: Flags [P.], cksum 0x0567 (correct), seq 3855:3891, ack 4410, win 318, options [nop,nop,TS val 1814823256 ecr 925951349], length 36
14:39:02.743123 IP (tos 0x10, ttl 64, id 47007, offset 0, flags [DF], proto TCP (6), length 52)
    192.168.0.104.55636 > 178.234.29.197.22: Flags [.], cksum 0xe5cf (correct), ack 3891, win 501, options [nop,nop,TS val 925951403 ecr 1814823256], length 0
14:39:02.762901 IP (tos 0x10, ttl 64, id 47008, offset 0, flags [DF], proto TCP (6), length 88)
    192.168.0.104.55636 > 178.234.29.197.22: Flags [P.], cksum 0x3061 (correct), seq 4410:4446, ack 3891, win 501, options [nop,nop,TS val 925951423 ecr 1814823256], length 36
14:39:02.801625 IP (tos 0x0, ttl 49, id 57753, offset 0, flags [DF], proto TCP (6), length 88)
    178.234.29.197.22 > 192.168.0.104.55636: Flags [P.], cksum 0xc493 (correct), seq 3891:3927, ack 4446, win 318, options [nop,nop,TS val 1814823275 ecr 925951423], length 36
14:39:02.801703 IP (tos 0x10, ttl 64, id 47009, offset 0, flags [DF], proto TCP (6), length 52)
    192.168.0.104.55636 > 178.234.29.197.22: Flags [.], cksum 0xe539 (correct), ack 3927, win 501, options [nop,nop,TS val 925951462 ecr 1814823275], length 0
14:39:02.883942 IP (tos 0x10, ttl 64, id 47010, offset 0, flags [DF], proto TCP (6), length 88)
    192.168.0.104.55636 > 178.234.29.197.22: Flags [P.], cksum 0x2807 (correct), seq 4446:4482, ack 3927, win 501, options [nop,nop,TS val 925951544 ecr 1814823275], length 36
14:39:02.924429 IP (tos 0x0, ttl 49, id 57754, offset 0, flags [DF], proto TCP (6), length 88)
    178.234.29.197.22 > 192.168.0.104.55636: Flags [P.], cksum 0x2d76 (correct), seq 3927:3963, ack 4482, win 318, options [nop,nop,TS val 1814823305 ecr 925951544], length 36
14:39:02.924556 IP (tos 0x10, ttl 64, id 47011, offset 0, flags [DF], proto TCP (6), length 52)
    192.168.0.104.55636 > 178.234.29.197.22: Flags [.], cksum 0xe458 (correct), ack 3963, win 501, options [nop,nop,TS val 925951585 ecr 1814823305], length 0
14:39:02.997449 IP (tos 0x10, ttl 64, id 47012, offset 0, flags [DF], proto TCP (6), length 88)
    192.168.0.104.55636 > 178.234.29.197.22: Flags [P.], cksum 0x7e0f (correct), seq 4482:4518, ack 3963, win 501, options [nop,nop,TS val 925951658 ecr 1814823305], length 36
14:39:03.043805 IP (tos 0x0, ttl 49, id 57755, offset 0, flags [DF], proto TCP (6), length 88)
    178.234.29.197.22 > 192.168.0.104.55636: Flags [P.], cksum 0xf92c (correct), seq 3963:3999, ack 4518, win 318, options [nop,nop,TS val 1814823334 ecr 925951658], length 36
14:39:03.043957 IP (tos 0x10, ttl 64, id 47013, offset 0, flags [DF], proto TCP (6), length 52)
    192.168.0.104.55636 > 178.234.29.197.22: Flags [.], cksum 0xe37c (correct), ack 3999, win 501, options [nop,nop,TS val 925951704 ecr 1814823334], length 0
14:39:04.117283 IP (tos 0x10, ttl 64, id 47014, offset 0, flags [DF], proto TCP (6), length 88)
    192.168.0.104.55636 > 178.234.29.197.22: Flags [P.], cksum 0xd27a (correct), seq 4518:4554, ack 3999, win 501, options [nop,nop,TS val 925952777 ecr 1814823334], length 36
14:39:04.156504 IP (tos 0x0, ttl 49, id 57756, offset 0, flags [DF], proto TCP (6), length 88)
    178.234.29.197.22 > 192.168.0.104.55636: Flags [P.], cksum 0x2103 (correct), seq 3999:4035, ack 4554, win 318, options [nop,nop,TS val 1814823614 ecr 925952777], length 36
14:39:04.156711 IP (tos 0x10, ttl 64, id 47015, offset 0, flags [DF], proto TCP (6), length 52)
    192.168.0.104.55636 > 178.234.29.197.22: Flags [.], cksum 0xddc3 (correct), ack 4035, win 501, options [nop,nop,TS val 925952817 ecr 1814823614], length 0
14:39:04.276988 IP (tos 0x10, ttl 64, id 47016, offset 0, flags [DF], proto TCP (6), length 88)
    192.168.0.104.55636 > 178.234.29.197.22: Flags [P.], cksum 0x9ad2 (correct), seq 4554:4590, ack 4035, win 501, options [nop,nop,TS val 925952937 ecr 1814823614], length 36
14:39:04.332778 IP (tos 0x0, ttl 49, id 57757, offset 0, flags [DF], proto TCP (6), length 88)
    178.234.29.197.22 > 192.168.0.104.55636: Flags [P.], cksum 0xabde (correct), seq 4035:4071, ack 4590, win 318, options [nop,nop,TS val 1814823654 ecr 925952937], length 36
14:39:04.332924 IP (tos 0x10, ttl 64, id 47017, offset 0, flags [DF], proto TCP (6), length 52)
    192.168.0.104.55636 > 178.234.29.197.22: Flags [.], cksum 0xdca3 (correct), ack 4071, win 501, options [nop,nop,TS val 925952993 ecr 1814823654], length 0
14:39:04.420710 IP (tos 0x10, ttl 64, id 47018, offset 0, flags [DF], proto TCP (6), length 88)
    192.168.0.104.55636 > 178.234.29.197.22: Flags [P.], cksum 0xa86e (correct), seq 4590:4626, ack 4071, win 501, options [nop,nop,TS val 925953081 ecr 1814823654], length 36
14:39:04.459680 IP (tos 0x0, ttl 49, id 57758, offset 0, flags [DF], proto TCP (6), length 88)
    178.234.29.197.22 > 192.168.0.104.55636: Flags [P.], cksum 0xb9a4 (correct), seq 4071:4107, ack 4626, win 318, options [nop,nop,TS val 1814823689 ecr 925953081], length 36
14:39:04.459786 IP (tos 0x10, ttl 64, id 47019, offset 0, flags [DF], proto TCP (6), length 52)
    192.168.0.104.55636 > 178.234.29.197.22: Flags [.], cksum 0xdbb9 (correct), ack 4107, win 501, options [nop,nop,TS val 925953120 ecr 1814823689], length 0
14:39:05.094582 IP (tos 0x10, ttl 64, id 47020, offset 0, flags [DF], proto TCP (6), length 88)
    192.168.0.104.55636 > 178.234.29.197.22: Flags [P.], cksum 0x18dc (correct), seq 4626:4662, ack 4107, win 501, options [nop,nop,TS val 925953755 ecr 1814823689], length 36
14:39:05.152417 IP (tos 0x0, ttl 49, id 57759, offset 0, flags [DF], proto TCP (6), length 88)
    178.234.29.197.22 > 192.168.0.104.55636: Flags [P.], cksum 0xca39 (correct), seq 4107:4143, ack 4662, win 318, options [nop,nop,TS val 1814823858 ecr 925953755], length 36
14:39:05.152633 IP (tos 0x10, ttl 64, id 47021, offset 0, flags [DF], proto TCP (6), length 52)
    192.168.0.104.55636 > 178.234.29.197.22: Flags [.], cksum 0xd813 (correct), ack 4143, win 501, options [nop,nop,TS val 925953813 ecr 1814823858], length 0
14:39:05.152718 IP (tos 0x0, ttl 49, id 57760, offset 0, flags [DF], proto TCP (6), length 200)
    178.234.29.197.22 > 192.168.0.104.55636: Flags [P.], cksum 0x421c (correct), seq 4143:4291, ack 4662, win 318, options [nop,nop,TS val 1814823859 ecr 925953755], length 148
14:39:05.152782 IP (tos 0x10, ttl 64, id 47022, offset 0, flags [DF], proto TCP (6), length 52)
    192.168.0.104.55636 > 178.234.29.197.22: Flags [.], cksum 0xd77f (correct), ack 4291, win 500, options [nop,nop,TS val 925953813 ecr 1814823859], length 0
14:39:05.152842 IP (tos 0x0, ttl 49, id 57761, offset 0, flags [DF], proto TCP (6), length 88)
    178.234.29.197.22 > 192.168.0.104.55636: Flags [P.], cksum 0x3bf9 (correct), seq 4291:4327, ack 4662, win 318, options [nop,nop,TS val 1814823859 ecr 925953755], length 36
14:39:05.152898 IP (tos 0x10, ttl 64, id 47023, offset 0, flags [DF], proto TCP (6), length 52)
    192.168.0.104.55636 > 178.234.29.197.22: Flags [.], cksum 0xd75b (correct), ack 4327, win 500, options [nop,nop,TS val 925953813 ecr 1814823859], length 0
14:39:05.668249 IP (tos 0x10, ttl 64, id 47024, offset 0, flags [DF], proto TCP (6), length 88)
    192.168.0.104.55636 > 178.234.29.197.22: Flags [P.], cksum 0x4334 (correct), seq 4662:4698, ack 4327, win 501, options [nop,nop,TS val 925954328 ecr 1814823859], length 36
14:39:05.714647 IP (tos 0x0, ttl 49, id 57762, offset 0, flags [DF], proto TCP (6), length 88)
    178.234.29.197.22 > 192.168.0.104.55636: Flags [P.], cksum 0x48db (correct), seq 4327:4363, ack 4698, win 318, options [nop,nop,TS val 1814824002 ecr 925954328], length 36
14:39:05.714826 IP (tos 0x10, ttl 64, id 47025, offset 0, flags [DF], proto TCP (6), length 52)
    192.168.0.104.55636 > 178.234.29.197.22: Flags [.], cksum 0xd451 (correct), ack 4363, win 501, options [nop,nop,TS val 925954375 ecr 1814824002], length 0
14:39:05.723281 IP (tos 0x10, ttl 64, id 47026, offset 0, flags [DF], proto TCP (6), length 88)
    192.168.0.104.55636 > 178.234.29.197.22: Flags [P.], cksum 0x6eba (correct), seq 4698:4734, ack 4363, win 501, options [nop,nop,TS val 925954383 ecr 1814824002], length 36
14:39:05.761704 IP (tos 0x0, ttl 49, id 57763, offset 0, flags [DF], proto TCP (6), length 88)
    178.234.29.197.22 > 192.168.0.104.55636: Flags [P.], cksum 0x9e14 (correct), seq 4363:4399, ack 4734, win 318, options [nop,nop,TS val 1814824015 ecr 925954383], length 36
14:39:05.797187 IP (tos 0x10, ttl 64, id 47027, offset 0, flags [DF], proto TCP (6), length 88)
    192.168.0.104.55636 > 178.234.29.197.22: Flags [P.], cksum 0xfa52 (correct), seq 4734:4770, ack 4399, win 501, options [nop,nop,TS val 925954457 ecr 1814824015], length 36
14:39:05.836888 IP (tos 0x0, ttl 49, id 57764, offset 0, flags [DF], proto TCP (6), length 88)
    178.234.29.197.22 > 192.168.0.104.55636: Flags [P.], cksum 0x9fb7 (correct), seq 4399:4435, ack 4770, win 318, options [nop,nop,TS val 1814824033 ecr 925954457], length 36
14:39:05.880681 IP (tos 0x10, ttl 64, id 47028, offset 0, flags [DF], proto TCP (6), length 52)
    192.168.0.104.55636 > 178.234.29.197.22: Flags [.], cksum 0xd2fc (correct), ack 4435, win 501, options [nop,nop,TS val 925954541 ecr 1814824033], length 0
14:39:06.252740 IP (tos 0x10, ttl 64, id 47029, offset 0, flags [DF], proto TCP (6), length 88)
    192.168.0.104.55636 > 178.234.29.197.22: Flags [P.], cksum 0x4a41 (correct), seq 4770:4806, ack 4435, win 501, options [nop,nop,TS val 925954913 ecr 1814824033], length 36
14:39:06.291786 IP (tos 0x0, ttl 49, id 57765, offset 0, flags [DF], proto TCP (6), length 88)
    178.234.29.197.22 > 192.168.0.104.55636: Flags [P.], cksum 0xd4f2 (correct), seq 4435:4471, ack 4806, win 318, options [nop,nop,TS val 1814824147 ecr 925954913], length 36
14:39:06.291946 IP (tos 0x10, ttl 64, id 47030, offset 0, flags [DF], proto TCP (6), length 52)
    192.168.0.104.55636 > 178.234.29.197.22: Flags [.], cksum 0xd0a7 (correct), ack 4471, win 501, options [nop,nop,TS val 925954952 ecr 1814824147], length 0
14:39:06.296226 IP (tos 0x0, ttl 49, id 57766, offset 0, flags [DF], proto TCP (6), length 140)
    178.234.29.197.22 > 192.168.0.104.55636: Flags [P.], cksum 0x84b6 (correct), seq 4471:4559, ack 4806, win 318, options [nop,nop,TS val 1814824147 ecr 925954913], length 88
14:39:06.296363 IP (tos 0x10, ttl 64, id 47031, offset 0, flags [DF], proto TCP (6), length 52)
    192.168.0.104.55636 > 178.234.29.197.22: Flags [.], cksum 0xd04a (correct), ack 4559, win 501, options [nop,nop,TS val 925954957 ecr 1814824147], length 0
14:39:06.296465 IP (tos 0x0, ttl 49, id 57767, offset 0, flags [DF], proto TCP (6), length 64)
    178.234.29.197.22 > 192.168.0.104.55636: Flags [.], cksum 0x4660 (correct), ack 4806, win 318, options [nop,nop,TS val 1814824148 ecr 925954913,nop,nop,sack 1 {4770:4806}], length 0
14:39:11.086137 IP (tos 0x10, ttl 64, id 47032, offset 0, flags [DF], proto TCP (6), length 88)
    192.168.0.104.55636 > 178.234.29.197.22: Flags [P.], cksum 0xffd9 (correct), seq 4806:4842, ack 4559, win 501, options [nop,nop,TS val 925959746 ecr 1814824148], length 36
14:39:11.124663 IP (tos 0x0, ttl 49, id 57768, offset 0, flags [DF], proto TCP (6), length 52)
    178.234.29.197.22 > 192.168.0.104.55636: Flags [.], cksum 0xb96f (correct), ack 4842, win 318, options [nop,nop,TS val 1814825356 ecr 925959746], length 0
14:39:11.124794 IP (tos 0x0, ttl 49, id 57769, offset 0, flags [DF], proto TCP (6), length 64)
    178.234.29.197.22 > 192.168.0.104.55636: Flags [.], cksum 0x2e5b (correct), ack 4842, win 318, options [nop,nop,TS val 1814825356 ecr 925959746,nop,nop,sack 1 {4806:4842}], length 0
14:39:11.124858 IP (tos 0x0, ttl 49, id 57770, offset 0, flags [DF], proto TCP (6), length 192)
    178.234.29.197.22 > 192.168.0.104.55636: Flags [P.], cksum 0x2627 (correct), seq 4559:4699, ack 4842, win 318, options [nop,nop,TS val 1814825356 ecr 925959746], length 140
14:39:11.124937 IP (tos 0x10, ttl 64, id 47033, offset 0, flags [DF], proto TCP (6), length 52)
    192.168.0.104.55636 > 178.234.29.197.22: Flags [.], cksum 0xb806 (correct), ack 4699, win 500, options [nop,nop,TS val 925959785 ecr 1814825356], length 0
14:39:11.125021 IP (tos 0x0, ttl 49, id 57771, offset 0, flags [DF], proto TCP (6), length 124)
    178.234.29.197.22 > 192.168.0.104.55636: Flags [P.], cksum 0xfaa9 (correct), seq 4699:4771, ack 4842, win 318, options [nop,nop,TS val 1814825356 ecr 925959746], length 72
14:39:11.125063 IP (tos 0x10, ttl 64, id 47034, offset 0, flags [DF], proto TCP (6), length 52)
    192.168.0.104.55636 > 178.234.29.197.22: Flags [.], cksum 0xb7be (correct), ack 4771, win 500, options [nop,nop,TS val 925959785 ecr 1814825356], length 0
14:39:11.125733 IP (tos 0x10, ttl 64, id 47035, offset 0, flags [DF], proto TCP (6), length 88)
    192.168.0.104.55636 > 178.234.29.197.22: Flags [P.], cksum 0xeb65 (correct), seq 4842:4878, ack 4771, win 501, options [nop,nop,TS val 925959786 ecr 1814825356], length 36
14:39:11.125910 IP (tos 0x10, ttl 64, id 47036, offset 0, flags [DF], proto TCP (6), length 112)
    192.168.0.104.55636 > 178.234.29.197.22: Flags [P.], cksum 0x17c9 (correct), seq 4878:4938, ack 4771, win 501, options [nop,nop,TS val 925959786 ecr 1814825356], length 60
14:39:11.126195 IP (tos 0x10, ttl 64, id 47037, offset 0, flags [DF], proto TCP (6), length 52)
    192.168.0.104.55636 > 178.234.29.197.22: Flags [F.], cksum 0xb75b (correct), seq 4938, ack 4771, win 501, options [nop,nop,TS val 925959786 ecr 1814825356], length 0
14:39:11.126292 IP (tos 0x0, ttl 49, id 57772, offset 0, flags [DF], proto TCP (6), length 64)
    178.234.29.197.22 > 192.168.0.104.55636: Flags [.], cksum 0x2d87 (correct), ack 4842, win 318, options [nop,nop,TS val 1814825356 ecr 925959746,nop,nop,sack 1 {4806:4842}], length 0
14:39:11.127143 IP (tos 0x0, ttl 49, id 57773, offset 0, flags [DF], proto TCP (6), length 64)
    178.234.29.197.22 > 192.168.0.104.55636: Flags [.], cksum 0x2d87 (correct), ack 4842, win 318, options [nop,nop,TS val 1814825356 ecr 925959746,nop,nop,sack 1 {4806:4842}], length 0
14:39:11.127258 IP (tos 0x0, ttl 49, id 57774, offset 0, flags [DF], proto TCP (6), length 64)
    178.234.29.197.22 > 192.168.0.104.55636: Flags [.], cksum 0x2d87 (correct), ack 4842, win 318, options [nop,nop,TS val 1814825356 ecr 925959746,nop,nop,sack 1 {4806:4842}], length 0
14:39:11.163897 IP (tos 0x0, ttl 49, id 57775, offset 0, flags [DF], proto TCP (6), length 52)
    178.234.29.197.22 > 192.168.0.104.55636: Flags [.], cksum 0xb846 (correct), ack 4878, win 318, options [nop,nop,TS val 1814825365 ecr 925959786], length 0
14:39:11.164001 IP (tos 0x0, ttl 49, id 57776, offset 0, flags [DF], proto TCP (6), length 52)
    178.234.29.197.22 > 192.168.0.104.55636: Flags [.], cksum 0xb80a (correct), ack 4938, win 318, options [nop,nop,TS val 1814825365 ecr 925959786], length 0
14:39:11.167124 IP (tos 0x0, ttl 49, id 57777, offset 0, flags [DF], proto TCP (6), length 52)
    178.234.29.197.22 > 192.168.0.104.55636: Flags [F.], cksum 0xb807 (correct), seq 4771, ack 4939, win 318, options [nop,nop,TS val 1814825366 ecr 925959786], length 0
14:39:11.167236 IP (tos 0x10, ttl 64, id 47038, offset 0, flags [DF], proto TCP (6), length 52)
    192.168.0.104.55636 > 178.234.29.197.22: Flags [.], cksum 0xb727 (correct), ack 4772, win 501, options [nop,nop,TS val 925959827 ecr 1814825366], length 0
14:39:11.205702 IP (tos 0x0, ttl 49, id 3878, offset 0, flags [DF], proto TCP (6), length 40)
    178.234.29.197.22 > 192.168.0.104.55636: Flags [R], cksum 0x50b8 (correct), seq 790414561, win 0, length 0
14:39:39.304545 IP (tos 0x0, ttl 64, id 47039, offset 0, flags [DF], proto TCP (6), length 60)
    192.168.0.104.55654 > 178.234.29.197.22: Flags [S], cksum 0x0ff9 (correct), seq 2159912301, win 64240, options [mss 1460,sackOK,TS val 925987965 ecr 0,nop,wscale 7], length 0
14:39:39.344842 IP (tos 0x0, ttl 49, id 0, offset 0, flags [DF], proto TCP (6), length 60)
    178.234.29.197.22 > 192.168.0.104.55654: Flags [S.], cksum 0xc597 (correct), seq 572006614, ack 2159912302, win 28960, options [mss 1440,sackOK,TS val 1814832410 ecr 925987965,nop,wscale 7], length 0
14:39:39.345029 IP (tos 0x0, ttl 64, id 47040, offset 0, flags [DF], proto TCP (6), length 52)
    192.168.0.104.55654 > 178.234.29.197.22: Flags [.], cksum 0x6352 (correct), ack 1, win 502, options [nop,nop,TS val 925988005 ecr 1814832410], length 0
14:39:39.348616 IP (tos 0x0, ttl 64, id 47041, offset 0, flags [DF], proto TCP (6), length 93)
    192.168.0.104.55654 > 178.234.29.197.22: Flags [P.], cksum 0x41f5 (correct), seq 1:42, ack 1, win 502, options [nop,nop,TS val 925988009 ecr 1814832410], length 41
14:39:39.388107 IP (tos 0x0, ttl 49, id 3508, offset 0, flags [DF], proto TCP (6), length 52)
    178.234.29.197.22 > 192.168.0.104.55654: Flags [.], cksum 0x642c (correct), ack 42, win 227, options [nop,nop,TS val 1814832422 ecr 925988009], length 0
14:39:39.391540 IP (tos 0x0, ttl 49, id 3509, offset 0, flags [DF], proto TCP (6), length 94)
    178.234.29.197.22 > 192.168.0.104.55654: Flags [P.], cksum 0x3da5 (correct), seq 1:43, ack 42, win 227, options [nop,nop,TS val 1814832422 ecr 925988009], length 42
14:39:39.391696 IP (tos 0x0, ttl 64, id 47042, offset 0, flags [DF], proto TCP (6), length 52)
    192.168.0.104.55654 > 178.234.29.197.22: Flags [.], cksum 0x62c4 (correct), ack 43, win 502, options [nop,nop,TS val 925988052 ecr 1814832422], length 0
14:39:39.391807 IP (tos 0x0, ttl 49, id 3510, offset 0, flags [DF], proto TCP (6), length 64)
    178.234.29.197.22 > 192.168.0.104.55654: Flags [.], cksum 0xe169 (correct), ack 42, win 227, options [nop,nop,TS val 1814832422 ecr 925988009,nop,nop,sack 1 {1:42}], length 0
14:39:39.394817 IP (tos 0x0, ttl 64, id 47043, offset 0, flags [DF], proto TCP (6), length 1480)
    192.168.0.104.55654 > 178.234.29.197.22: Flags [.], cksum 0x4572 (correct), seq 42:1470, ack 43, win 502, options [nop,nop,TS val 925988055 ecr 1814832422], length 1428
14:39:39.394869 IP (tos 0x0, ttl 64, id 47044, offset 0, flags [DF], proto TCP (6), length 136)
    192.168.0.104.55654 > 178.234.29.197.22: Flags [P.], cksum 0x2f57 (correct), seq 1470:1554, ack 43, win 502, options [nop,nop,TS val 925988055 ecr 1814832422], length 84
14:39:39.432435 IP (tos 0x0, ttl 49, id 3511, offset 0, flags [DF], proto TCP (6), length 1028)
    178.234.29.197.22 > 192.168.0.104.55654: Flags [P.], cksum 0x76cf (correct), seq 43:1019, ack 42, win 227, options [nop,nop,TS val 1814832432 ecr 925988052], length 976
14:39:39.432570 IP (tos 0x0, ttl 64, id 47045, offset 0, flags [DF], proto TCP (6), length 52)
    192.168.0.104.55654 > 178.234.29.197.22: Flags [.], cksum 0x58e0 (correct), ack 1019, win 495, options [nop,nop,TS val 925988093 ecr 1814832432], length 0
14:39:39.434447 IP (tos 0x0, ttl 49, id 3512, offset 0, flags [DF], proto TCP (6), length 52)
    178.234.29.197.22 > 192.168.0.104.55654: Flags [.], cksum 0x59fa (correct), ack 1554, win 250, options [nop,nop,TS val 1814832433 ecr 925988055], length 0
14:39:39.448626 IP (tos 0x0, ttl 64, id 47046, offset 0, flags [DF], proto TCP (6), length 100)
    192.168.0.104.55654 > 178.234.29.197.22: Flags [P.], cksum 0x48cd (correct), seq 1554:1602, ack 1019, win 501, options [nop,nop,TS val 925988109 ecr 1814832433], length 48
14:39:39.487184 IP (tos 0x0, ttl 49, id 3513, offset 0, flags [DF], proto TCP (6), length 52)
    178.234.29.197.22 > 192.168.0.104.55654: Flags [.], cksum 0x5987 (correct), ack 1602, win 250, options [nop,nop,TS val 1814832446 ecr 925988109], length 0
14:39:39.499663 IP (tos 0x0, ttl 49, id 3514, offset 0, flags [DF], proto TCP (6), length 416)
    178.234.29.197.22 > 192.168.0.104.55654: Flags [P.], cksum 0xca2b (correct), seq 1019:1383, ack 1602, win 250, options [nop,nop,TS val 1814832449 ecr 925988109], length 364
14:39:39.499790 IP (tos 0x0, ttl 64, id 47047, offset 0, flags [DF], proto TCP (6), length 52)
    192.168.0.104.55654 > 178.234.29.197.22: Flags [.], cksum 0x56ec (correct), ack 1383, win 499, options [nop,nop,TS val 925988160 ecr 1814832449], length 0
14:39:39.516075 IP (tos 0x0, ttl 64, id 47048, offset 0, flags [DF], proto TCP (6), length 68)
    192.168.0.104.55654 > 178.234.29.197.22: Flags [P.], cksum 0x4ca1 (correct), seq 1602:1618, ack 1383, win 501, options [nop,nop,TS val 925988176 ecr 1814832449], length 16
14:39:39.592203 IP (tos 0x0, ttl 49, id 3515, offset 0, flags [DF], proto TCP (6), length 52)
    178.234.29.197.22 > 192.168.0.104.55654: Flags [.], cksum 0x57ad (correct), ack 1618, win 250, options [nop,nop,TS val 1814832473 ecr 925988176], length 0
14:39:39.592362 IP (tos 0x0, ttl 64, id 47049, offset 0, flags [DF], proto TCP (6), length 96)
    192.168.0.104.55654 > 178.234.29.197.22: Flags [P.], cksum 0x8f3f (correct), seq 1618:1662, ack 1383, win 501, options [nop,nop,TS val 925988253 ecr 1814832473], length 44
14:39:39.631577 IP (tos 0x0, ttl 49, id 3516, offset 0, flags [DF], proto TCP (6), length 52)
    178.234.29.197.22 > 192.168.0.104.55654: Flags [.], cksum 0x572b (correct), ack 1662, win 250, options [nop,nop,TS val 1814832482 ecr 925988253], length 0
14:39:39.631651 IP (tos 0x0, ttl 49, id 3517, offset 0, flags [DF], proto TCP (6), length 96)
    178.234.29.197.22 > 192.168.0.104.55654: Flags [P.], cksum 0xd360 (correct), seq 1383:1427, ack 1662, win 250, options [nop,nop,TS val 1814832482 ecr 925988253], length 44
14:39:39.632285 IP (tos 0x0, ttl 64, id 47050, offset 0, flags [DF], proto TCP (6), length 120)
    192.168.0.104.55654 > 178.234.29.197.22: Flags [P.], cksum 0x84e4 (correct), seq 1662:1730, ack 1427, win 501, options [nop,nop,TS val 925988292 ecr 1814832482], length 68
14:39:39.672576 IP (tos 0x0, ttl 49, id 3518, offset 0, flags [DF], proto TCP (6), length 104)
    178.234.29.197.22 > 192.168.0.104.55654: Flags [P.], cksum 0x974d (correct), seq 1427:1479, ack 1730, win 250, options [nop,nop,TS val 1814832492 ecr 925988292], length 52
14:39:39.673230 IP (tos 0x0, ttl 64, id 47051, offset 0, flags [DF], proto TCP (6), length 552)
    192.168.0.104.55654 > 178.234.29.197.22: Flags [P.], cksum 0x65f3 (correct), seq 1730:2230, ack 1479, win 501, options [nop,nop,TS val 925988333 ecr 1814832492], length 500
14:39:39.713268 IP (tos 0x0, ttl 49, id 3519, offset 0, flags [DF], proto TCP (6), length 512)
    178.234.29.197.22 > 192.168.0.104.55654: Flags [P.], cksum 0xbdbc (correct), seq 1479:1939, ack 2230, win 273, options [nop,nop,TS val 1814832503 ecr 925988333], length 460
14:39:39.745608 IP (tos 0x0, ttl 64, id 47052, offset 0, flags [DF], proto TCP (6), length 960)
    192.168.0.104.55654 > 178.234.29.197.22: Flags [P.], cksum 0x5a89 (correct), seq 2230:3138, ack 1939, win 501, options [nop,nop,TS val 925988406 ecr 1814832503], length 908
14:39:39.786991 IP (tos 0x0, ttl 49, id 3520, offset 0, flags [DF], proto TCP (6), length 80)
    178.234.29.197.22 > 192.168.0.104.55654: Flags [P.], cksum 0xfc0e (correct), seq 1939:1967, ack 3138, win 295, options [nop,nop,TS val 1814832521 ecr 925988406], length 28
14:39:39.788065 IP (tos 0x0, ttl 64, id 47053, offset 0, flags [DF], proto TCP (6), length 164)
    192.168.0.104.55654 > 178.234.29.197.22: Flags [P.], cksum 0x38ee (correct), seq 3138:3250, ack 1967, win 501, options [nop,nop,TS val 925988448 ecr 1814832521], length 112
14:39:39.866168 IP (tos 0x0, ttl 49, id 3521, offset 0, flags [DF], proto TCP (6), length 52)
    178.234.29.197.22 > 192.168.0.104.55654: Flags [.], cksum 0x4d84 (correct), ack 3250, win 295, options [nop,nop,TS val 1814832541 ecr 925988448], length 0
14:39:40.044865 IP (tos 0x0, ttl 49, id 3522, offset 0, flags [DF], proto TCP (6), length 992)
    178.234.29.197.22 > 192.168.0.104.55654: Flags [P.], cksum 0x8013 (correct), seq 1967:2907, ack 3250, win 295, options [nop,nop,TS val 1814832585 ecr 925988448], length 940
14:39:40.088479 IP (tos 0x0, ttl 64, id 47054, offset 0, flags [DF], proto TCP (6), length 52)
    192.168.0.104.55654 > 178.234.29.197.22: Flags [.], cksum 0x47b1 (correct), ack 2907, win 501, options [nop,nop,TS val 925988749 ecr 1814832585], length 0
14:39:40.138222 IP (tos 0x0, ttl 49, id 3523, offset 0, flags [DF], proto TCP (6), length 96)
    178.234.29.197.22 > 192.168.0.104.55654: Flags [P.], cksum 0xad1e (correct), seq 2907:2951, ack 3250, win 295, options [nop,nop,TS val 1814832606 ecr 925988749], length 44
14:39:40.138344 IP (tos 0x0, ttl 64, id 47055, offset 0, flags [DF], proto TCP (6), length 52)
    192.168.0.104.55654 > 178.234.29.197.22: Flags [.], cksum 0x473e (correct), ack 2951, win 501, options [nop,nop,TS val 925988799 ecr 1814832606], length 0
14:39:40.139097 IP (tos 0x8, ttl 64, id 47056, offset 0, flags [DF], proto TCP (6), length 824)
    192.168.0.104.55654 > 178.234.29.197.22: Flags [P.], cksum 0xc326 (correct), seq 3250:4022, ack 2951, win 501, options [nop,nop,TS val 925988799 ecr 1814832606], length 772
14:39:40.182725 IP (tos 0x0, ttl 49, id 3524, offset 0, flags [DF], proto TCP (6), length 52)
    178.234.29.197.22 > 192.168.0.104.55654: Flags [.], cksum 0x44e3 (correct), ack 4022, win 318, options [nop,nop,TS val 1814832620 ecr 925988799], length 0
14:39:40.182846 IP (tos 0x0, ttl 49, id 3525, offset 0, flags [DF], proto TCP (6), length 124)
    178.234.29.197.22 > 192.168.0.104.55654: Flags [P.], cksum 0xba62 (correct), seq 2951:3023, ack 4022, win 318, options [nop,nop,TS val 1814832620 ecr 925988799], length 72
14:39:40.182904 IP (tos 0x8, ttl 64, id 47057, offset 0, flags [DF], proto TCP (6), length 52)
    192.168.0.104.55654 > 178.234.29.197.22: Flags [.], cksum 0x43b8 (correct), ack 3023, win 501, options [nop,nop,TS val 925988843 ecr 1814832620], length 0
14:39:40.191159 IP (tos 0x0, ttl 49, id 3526, offset 0, flags [DF], proto TCP (6), length 88)
    178.234.29.197.22 > 192.168.0.104.55654: Flags [P.], cksum 0x5001 (correct), seq 3023:3059, ack 4022, win 318, options [nop,nop,TS val 1814832621 ecr 925988799], length 36
14:39:40.191302 IP (tos 0x8, ttl 64, id 47058, offset 0, flags [DF], proto TCP (6), length 52)
    192.168.0.104.55654 > 178.234.29.197.22: Flags [.], cksum 0x438b (correct), ack 3059, win 501, options [nop,nop,TS val 925988851 ecr 1814832621], length 0
14:39:40.193239 IP (tos 0x8, ttl 64, id 47059, offset 0, flags [DF], proto TCP (6), length 104)
    192.168.0.104.55654 > 178.234.29.197.22: Flags [P.], cksum 0x80f0 (correct), seq 4022:4074, ack 3059, win 501, options [nop,nop,TS val 925988853 ecr 1814832621], length 52
14:39:40.233090 IP (tos 0x0, ttl 49, id 3527, offset 0, flags [DF], proto TCP (6), length 88)
    178.234.29.197.22 > 192.168.0.104.55654: Flags [P.], cksum 0xa7dd (correct), seq 3059:3095, ack 4074, win 318, options [nop,nop,TS val 1814832633 ecr 925988853], length 36
14:39:40.233219 IP (tos 0x8, ttl 64, id 47060, offset 0, flags [DF], proto TCP (6), length 52)
    192.168.0.104.55654 > 178.234.29.197.22: Flags [.], cksum 0x42fd (correct), ack 3095, win 501, options [nop,nop,TS val 925988893 ecr 1814832633], length 0
14:39:40.235096 IP (tos 0x8, ttl 64, id 47061, offset 0, flags [DF], proto TCP (6), length 112)
    192.168.0.104.55654 > 178.234.29.197.22: Flags [P.], cksum 0x771e (correct), seq 4074:4134, ack 3095, win 501, options [nop,nop,TS val 925988895 ecr 1814832633], length 60
14:39:40.275111 IP (tos 0x0, ttl 49, id 3528, offset 0, flags [DF], proto TCP (6), length 88)
    178.234.29.197.22 > 192.168.0.104.55654: Flags [P.], cksum 0x0874 (correct), seq 3095:3131, ack 4134, win 318, options [nop,nop,TS val 1814832643 ecr 925988895], length 36
14:39:40.276085 IP (tos 0x8, ttl 64, id 47062, offset 0, flags [DF], proto TCP (6), length 88)
    192.168.0.104.55654 > 178.234.29.197.22: Flags [P.], cksum 0x5637 (correct), seq 4134:4170, ack 3131, win 501, options [nop,nop,TS val 925988936 ecr 1814832643], length 36
14:39:40.318052 IP (tos 0x0, ttl 49, id 3529, offset 0, flags [DF], proto TCP (6), length 176)
